{
 "id": "bill-rosenberg",
 "type": "person",
 "names": {
  "name": "Bill Rosenberg",
  "aliases": [
   "William Rosenberg"
  ],
  "said": "Worked out what people bought and sold them only that."
 },
 "region": [
  "new-england"
 ],
 "facets": {
  "role": "founder",
  "state": "MA"
 },
 "text": {
  "what": "Opened the Open Kettle in Quincy, Massachusetts in 1948 and renamed it Dunkin' Donuts in 1950.",
  "story": "Rosenberg had been selling food to factories and construction sites, and found donuts and coffee were the two things people bought. He built the shop around the pair, introduced a logo in 1953 and the mascot Dunkie in 1954, and started selling franchises in 1955. Johnny Spartos, one of the men running the Quincy shop, talked him into a donut with a handle, made for dunking. His son Bob became chief executive in 1963 at 25, the year the hundredth shop opened.",
  "today": "Dunkin' dropped Donuts from its name in 2019 and kept selling them."
 },
 "kin": [
  {
   "to": "dunkin",
   "as": "The company.",
   "rel": "org"
  },
  {
   "to": "dunkin-country",
   "as": "The region it shaped.",
   "rel": "style"
  },
  {
   "to": "the-pot-of-coffee",
   "as": "The other half of what he sold.",
   "rel": "dish"
  }
 ],
 "sources": [
  "s:wp-dunkin-donuts"
 ],
 "provenance": {
  "default": {
   "tier": "cited",
   "source": "s:wp-dunkin-donuts"
  },
  "fields": {
   "names.said": {
    "tier": "tradition"
   }
  }
 },
 "schema": 1,
 "confidence": "high",
 "updated": "2026-09-16"
}